c70cf489-22bf-4912-9fd9-a387cf15e0f0	Jewelry	Sterling Silver Princess Cut Light Blue & Olive Green Cubic Zirconia CZ Ring
c910b932-fbd4-4a5d-beaf-89054c3cc5df	Kitchen	Applica/Spectrum Brands G48TD Waffle Maker/Griddle, Stainless Steel, 1200-Watt
067fda12-a898-4d12-846c-0a98d42734b6	Kitchen	Miles Kimball Black Banana Holder Tree
c2273fa4-8a03-4fa3-b97e-c1ef73e976c4	Jewelry	Men's Stainless Steel Wood Inlay Cuff Bracelet
8cb52bf5-2c86-4e17-a063-6c85207ba922	Jewelry	Pro Jewelry 925 Sterling Silver Birthstone July Ruby Red Crystal Spacer Bead
69068ffd-f995-4f4b-baf9-1698fc4b9a12	Kitchen	Wilton Recipe Right Oblong Pan with Cover
ae255001-97fb-4959-93f6-fc05d2d1b1e0	Jewelry	Beads Hunter (Set of 2) Sterling Silver Crystal Stone Round Ball Beads (Blue)
6b1c35c1-83f9-425f-8c11-3df32bd7de43	Kitchen	Pre-Programmed Digital Meat Thermometer - Instant Probe Read -5 BBQ Cooking Program - Dad Birthday Gift Idea
802f4ee7-b017-4c39-b9d5-7321496f07a6	Kitchen	Keurig K45 Elite Coconut White Single Cup Home Brewing System
90659100-f58e-415e-a389-9d8fa84204b5	Jewelry	20mm 14k Gold Plated Hip Hop Jumbo Dookie Rope Chain Necklace + Microfiber Jewelry Polishing Cloth
3e1d6e5a-992d-4c0b-b361-ef2a9df6d688	Kitchen	Bormioli Rocco Airtight Jar
02048d7b-5d70-437e-a23c-ca5cbcfbd357	Jewelry	"BodFx ""Marble Man"" 72 Piece Complete Ear Stretching Kit. 14g-00g"
883b7378-f733-4f73-9910-c6a82170d882	Jewelry	"Sterling Silver Oxidized Celtic Tree of Life Pendant Necklace, 18"""
ccfec946-c11e-43f4-ae0b-cb2fa616eaa2	Jewelry	Comos Parrty Office Flower Small Faux Pearl Pin Crystal Brooch White
aa0101e5-7d3c-4560-82f5-12c047f4651b	Kitchen	Reusable Premium Metal Filters by Slimm Filter for Use in the AeroPress Coffee Maker, Package of 2 Filters
5420f885-e52f-4cde-8b11-876110299ae5	Jewelry	Sterling Silver Round Cut Cubic Zirconia Stud Earrings
7982ffce-b3c8-4dab-a1a2-e3cd429fea78	Kitchen	California Home Goods CHG-IT1 2-Inch Silicone Ice Cube Tray (3 Pack)
6ba86d0a-d5f4-4660-98c1-4d31f5dbe817	Kitchen	Gourmet Basics by Mikasa Countryside 2-Tier Flat-Back Metal Basket, Antique Black
0a8e8485-dee6-4cbf-9803-7413ace20c97	Kitchen	Englewood Marketing Group BJX-5 Jumbo Jerky Works Kit
3e78b304-b02f-426c-9e2a-287593aea1e8	Jewelry	"Sterling Silver Front-Back Cubic Zirconia 2mm Hoop Earrings (2"" Diameter, 7.2 cttw)"
a95739cd-aa4f-4cbd-b752-b6c1f583f62b	Jewelry	Honey Amber Sterling Silver Small Square Stud Earrings
ab4d76ae-ed22-4630-9afc-d0db02949c03	Jewelry	Mixi Multicolor Rope Leather Bracelets Fashion Adjustable Rope Wristband Cuff Bracelet
73c6f830-7d7c-4ed5-9805-15baa3de97fe	Kitchen	Pelican 45 Quart Elite Ice Chest Cooler, White
cbb67e27-5c16-43f1-a725-a94e52922264	Kitchen	Keurig K45 Elite Coconut White Single Cup Home Brewing System
bbda2255-009f-4e54-ba4a-7f0df689a3a9	Kitchen	Rollie Hands-Free Automatic Electric Vertical Nonstick Easy Quick Egg Cooker
6a119ac0-8a06-4cd1-85bb-46dc64c388b7	Kitchen	bubba 34 oz travel mug classic fuchsia
7aedf762-f413-4b5c-820e-20965e99e9da	Jewelry	"Alex and Ani ""Charity By Design"" Best Friends Bangle Bracelet, Set Of 2"
838a9902-f7af-4414-ac03-0ec2da33a174	Jewelry	Nose Ring Hoop Set 18 Gauge (1mm) 3/8 Inch Length (10mm) 12 Pieces - 6 Pairs
1685a6a2-a482-4d5c-bbfa-beff6f31a36c	Kitchen	Refrigerator or Freezer Thermostat (Temperature Controller)
7cd5891e-b4a7-4765-8879-5bddfc1eae40	Kitchen	Kotobuki Condiment Containers for Bento Box, Mini
28cc0d9d-2ff0-45ee-ade0-c182b4ec5e1a	Kitchen	Aladdin 3 Classic Mason Jar Tumblers w/Straws & Lids Purple Turquoise Red 20 Oz
af1cb938-5a85-44d6-929e-7d0683086f1a	Jewelry	10k Gold Swarovski Zirconia Studs (1 cttw)
c78044fe-d5d7-4132-a1ed-af4359b2a6d1	Jewelry	Sorrelli Luxurious Emerald-Cut Cocktail Ring
2b8c9707-0b88-4ca5-b5c6-5c286e6d001f	Jewelry	Lot of 20 Multi Crystals Nose Rings Bone Nose Stud Bar Barbell Piercing 0.8mm
661302d8-c7de-418b-9d03-3fc0217b46b2	Kitchen	Standard Butter Dish(Colors May Vary)
4605d3bb-a3ef-4c14-a5d8-8ee49634cc0e	Kitchen	Whiskey Stones - Yukiss? Set of 8 with Plastic Storage Box Tongs, Stainless Steel Reusable Wine Ice Cubes, Best Whiskey Chiller, Greatest Whiskey Chilling Rocks, Whisky Stones and Sipping Stones
bc7e479f-c4c0-40f6-973c-4eaa5ae680a9	Jewelry	AGS Certified 3/4 Carat TW Diamond Halo Engagement Ring in 14K White Gold (K-L Color, I2-I3 Clarity)
df4fb301-6c31-4c99-8977-0a8c7801bc19	Jewelry	JY Jewelry Band Gold Tone Headpiece Chain Hairband BOHO Charm Band Hair
c7f3f86a-1de7-4ee4-8b75-96228b9d6bba	Jewelry	Jane Stone Fashion Necklace Yellow Bubble Beaded Necklace Bib Statement Necklace Bridesmaid Wedding Necklace (Fn0627-Yellow)
3a9eaa75-41fe-4140-b7bb-c8f70badfcf7	Kitchen	Chef'n VeggiChop Hand-Powered Food Chopper
002c7a2c-d07b-40e4-83d2-140d18db5387	Kitchen	Blank Arrow Yard Sign (blank w/red border) Party Accessory  (1 count)
fc151034-9330-40d6-8dce-8207ec78c3bf	Kitchen	George Foreman GRP1060B 4 Serving Removable Plate Grill, Black
ca944bb8-fe2b-444f-92dc-4726e434c197	Kitchen	New Star Foodservice 43204 Commercial Grade French Fry Cutter with Suction Feet, 1/2 Inch and 3/8 Inch Blades, Limited Edition Black
737082ee-9363-4c80-98ef-1f2cd25a27d1	Jewelry	Body Accentz&reg; 316L Nose Screw Bonus Pack with 5 Assorted 2mm Gem 18g
b7856c82-500f-4cbc-a790-4a931a20f8c5	Kitchen	OXO Good Grips Classic Tea Kettle, Brushed Stainless
877bf80b-f1fc-42f9-9d8b-8b7f523d426d	Kitchen	Tupperware Sheerly Elegant Pitcher
212ef621-603f-4911-9c36-8d0f369250c7	Kitchen	Emsa Perfect Beaker
c0eddca4-8ad8-4ca5-9ab1-404050dde240	Kitchen	Thermos ELEMENT5 16-Ounce Food Jar
d8969393-3567-4cc7-a979-2373c8725738	Kitchen	Farberware Classic 17-Piece Tool and Gadget Set
